{
  "$schema": "https://json-schema.org/draft/2020-12/schema",
  "$id": "legacy-skill-corpus.schema.json",
  "title": "Legacy Skill Corpus Manifest v1",
  "type": "object",
  "additionalProperties": false,
  "required": ["schema_version", "corpus_class", "source_revision", "entries"],
  "properties": {
    "schema_version": {"const": "1.0"},
    "corpus_class": {"enum": ["test_reference", "production_seed"]},
    "source_revision": {"type": "string", "pattern": "^[a-f0-9]{40}$"},
    "entries": {
      "type": "array",
      "minItems": 3,
      "items": {
        "type": "object",
        "additionalProperties": false,
        "required": ["skill_id", "version", "source_path", "source_symbol", "fixture_path", "content_hash"],
        "properties": {
          "skill_id": {"type": "string", "minLength": 1},
          "version": {"type": "string", "minLength": 1},
          "source_path": {"type": "string", "minLength": 1},
          "source_symbol": {"type": "string", "minLength": 1},
          "fixture_path": {"type": "string", "minLength": 1},
          "content_hash": {"type": "string", "pattern": "^sha256:[a-f0-9]{64}$"}
        }
      }
    }
  }
}
