{
  "schema_version": "1.0",
  "corpus_class": "production_seed",
  "source_revision": "6c6594d42c08ae3757a72aa0e654a3fe555e4077",
  "entries": [
    {
      "skill_id": "skill_purchase_001",
      "version": "1.0.0",
      "source_path": "backend/app/db/seed.py",
      "source_symbol": "PURCHASE_SKILL",
      "fixture_path": "contracts/agent/v1/corpus/production_seed/purchase.json",
      "content_hash": "sha256:e23eb10457c7b5e060f291159b036ed2ec7f2a9587842ce84880ea5b5250cd83"
    },
    {
      "skill_id": "skill_price_compare_001",
      "version": "1.0.0",
      "source_path": "backend/app/db/seed.py",
      "source_symbol": "PRICE_COMPARE_SKILL",
      "fixture_path": "contracts/agent/v1/corpus/production_seed/price_compare.json",
      "content_hash": "sha256:f9944229f8e4e726a7b4b74d2afeca9317298cdc19e40d9f9b3d8f364eabc147"
    },
    {
      "skill_id": "after_sales_refund",
      "version": "1.0.0",
      "source_path": "backend/app/db/seed.py",
      "source_symbol": "REFUND_SKILL",
      "fixture_path": "contracts/agent/v1/corpus/production_seed/refund.json",
      "content_hash": "sha256:e98c30da190ed9fb13110326ea88389cb69c811e7492b05f687e5663e217ca57"
    }
  ]
}
